[
  {
    "id": "wb-intl-ds",
    "标题": "WorkBuddy 国际版 DeepSeek v4.1-flash 限时 0 扣费",
    "一句话": "腾讯 AI 办公软件国际版该模型挂 Free now，国内版同模型按 0.11x 收费",
    "怎么领": [
      "去 workbuddy.ai 下载国际版",
      "模型选 deepseek-v4.1-flash",
      "确认 Free now 标签在再动手"
    ],
    "链接": "https://www.workbuddy.ai",
    "品类": "软件试用",
    "地域": "海外",
    "版本": "国际版",
    "模型": "deepseek-v4.1-flash",
    "开始日期": "-",
    "结束日期": "2026-09-25",
    "状态": "有效",
    "验真": "已验真",
    "抓取时间": "2026-10-11"
  },
  {
    "id": "zhipu-flash",
    "标题": "智谱 GLM Flash 模型 0 元 + 新用户 2000 万券",
    "一句话": "4.x 代 Flash 系列直接 0 元调用，写代码跑 agent 的主力免费模型",
    "怎么领": [
      "智谱开放平台注册",
      "控制台申请 API key",
      "OpenAI 兼容接口即插即用"
    ],
    "链接": "https://open.bigmodel.cn",
    "品类": "API额度",
    "地域": "国内",
    "版本": "-",
    "模型": "glm-4-flash",
    "开始日期": "-",
    "结束日期": "-",
    "状态": "有效",
    "验真": "待验证",
    "抓取时间": "2026-10-11"
  },
  {
    "id": "siliconflow",
    "标题": "硅基流动 注册送 14 元券 + 一堆 0 元模型",
    "一句话": "模型多、OpenAI 兼容，接 Cherry Studio 当备用池最合适",
    "怎么领": [
      "官网注册",
      "账户领券",
      "0 元模型直接调"
    ],
    "链接": "https://cloud.siliconflow.cn",
    "品类": "API额度",
    "地域": "国内",
    "版本": "-",
    "模型": "-",
    "开始日期": "-",
    "结束日期": "-",
    "状态": "有效",
    "验真": "待验证",
    "抓取时间": "2026-10-11"
  },
  {
    "id": "qwen",
    "标题": "通义千问 每模型 100 万 token / 90 天",
    "一句话": "每个模型独立额度，中文内容、客服语料首选",
    "怎么领": [
      "阿里云百炼控制台开通",
      "90 天有效期，领了尽快用"
    ],
    "链接": "https://bailian.console.aliyun.com",
    "品类": "API额度",
    "地域": "国内",
    "版本": "-",
    "模型": "qwen",
    "开始日期": "-",
    "结束日期": "-",
    "状态": "有效",
    "验真": "待验证",
    "抓取时间": "2026-10-11"
  },
  {
    "id": "kimi",
    "标题": "Kimi 实名送 15 元券",
    "一句话": "长文本之王，读论文读长文档直接喂",
    "怎么领": [
      "Moonshot 开放平台实名认证",
      "认证后到账"
    ],
    "链接": "https://platform.kimi.com",
    "品类": "API额度",
    "地域": "国内",
    "版本": "-",
    "模型": "kimi-k2",
    "开始日期": "-",
    "结束日期": "-",
    "状态": "有效",
    "验真": "待验证",
    "抓取时间": "2026-10-11"
  },
  {
    "id": "groq",
    "标题": "Groq 免费层免绑卡",
    "一句话": "开源模型推理速度天花板，免费层 30 RPM / 1000 RPD",
    "怎么领": [
      "console.groq.com 注册",
      "拿 key 即用"
    ],
    "链接": "https://console.groq.com",
    "品类": "API额度",
    "地域": "海外",
    "版本": "-",
    "模型": "-",
    "开始日期": "-",
    "结束日期": "-",
    "状态": "有效",
    "验真": "待验证",
    "抓取时间": "2026-10-11"
  },
  {
    "id": "intel-common-minimax",
    "标题": "MiniMax 新用户 Token Plan 订阅/体验",
    "一句话": "新用户 Token Plan 订阅/体验（OpenAI 兼容，推荐模型：MiniMax-M3, MiniMax-M2.7）",
    "怎么领": [
      "申请直达：控制台申请（https://platform.minimax.cn/console/access?tab=api-keys）",
      "Base URL：https://api.minimax.chat/v1",
      "推荐免费模型：MiniMax-M3, MiniMax-M2.7"
    ],
    "链接": "https://platform.minimax.cn/console/access?tab=api-keys",
    "品类": "API额度",
    "地域": "国内",
    "版本": "-",
    "模型": "MiniMax-M3",
    "开始日期": "-",
    "结束日期": "-",
    "状态": "待验证",
    "验真": "待验证",
    "抓取时间": "2026-10-11"
  },
  {
    "id": "intel-common-小米mimo",
    "标题": "小米 MiMo TTS 系列限时免费；语言模型按量计费",
    "一句话": "TTS 系列限时免费；语言模型按量计费（OpenAI 兼容，推荐模型：mimo-v2.6-pro, mimo-v2.6-flash, mimo-v2.5-tts）",
    "怎么领": [
      "申请直达：控制台申请（https://platform.xiaomimimo.com/#/console/api-keys）",
      "Base URL：https://api.xiaomimimo.com/v1",
      "推荐免费模型：mimo-v2.6-pro, mimo-v2.6-flash, mimo-v2.5-tts"
    ],
    "链接": "https://platform.xiaomimimo.com/#/console/api-keys",
    "品类": "API额度",
    "地域": "国内",
    "版本": "-",
    "模型": "mimo-v2.6-pro",
    "开始日期": "-",
    "结束日期": "-",
    "状态": "待验证",
    "验真": "待验证",
    "抓取时间": "2026-10-11"
  },
  {
    "id": "intel-common-文心ernie",
    "标题": "文心 ERNIE 17 个模型各 100 万 / 3 个月",
    "一句话": "17 个模型各 100 万 / 3 个月（OpenAI 兼容，推荐模型：ernie-5.0, ernie-4.5-turbo, ernie-x1.1）",
    "怎么领": [
      "申请直达：控制台申请（https://console.bce.baidu.com/qianfan/overview）",
      "Base URL：https://qianfan.baidubce.com/v2",
      "推荐免费模型：ernie-5.0, ernie-4.5-turbo, ernie-x1.1"
    ],
    "链接": "https://console.bce.baidu.com/qianfan/overview",
    "品类": "API额度",
    "地域": "国内",
    "版本": "-",
    "模型": "ernie-5.0",
    "开始日期": "-",
    "结束日期": "-",
    "状态": "待验证",
    "验真": "待验证",
    "抓取时间": "2026-10-11"
  },
  {
    "id": "intel-common-googlegemini",
    "标题": "Google Gemini 免费层每日滚动重置（免绑卡）",
    "一句话": "免费层每日滚动重置（免绑卡）（OpenAI 兼容，推荐模型：gemini-2.5-flash, gemini-3.8-flash）",
    "怎么领": [
      "申请直达：AI Studio 申请（https://aistudio.google.com/apikey）",
      "Base URL：https://generativelanguage.googleapis.com/v1beta/openai/",
      "推荐免费模型：gemini-2.5-flash, gemini-3.8-flash"
    ],
    "链接": "https://aistudio.google.com/apikey",
    "品类": "API额度",
    "地域": "海外",
    "版本": "-",
    "模型": "gemini-2.5-flash",
    "开始日期": "-",
    "结束日期": "-",
    "状态": "待验证",
    "验真": "待验证",
    "抓取时间": "2026-10-11"
  },
  {
    "id": "intel-common-openrouter",
    "标题": "OpenRouter 20 RPM 免费层（免绑卡）",
    "一句话": "20 RPM 免费层（免绑卡）（OpenAI 兼容，推荐模型：选带 :free 后缀模型（如 google/gemma-4-31b-it:free、nvidia/nemotron-3-super-120b:free））",
    "怎么领": [
      "申请直达：控制台申请（https://openrouter.ai/keys）",
      "Base URL：https://openrouter.ai/api/v1",
      "推荐免费模型：选带 :free 后缀模型（如 google/gemma-4-31b-it:free、nvidia/nemotron-3-super-120b:free）"
    ],
    "链接": "https://openrouter.ai/keys",
    "品类": "API额度",
    "地域": "海外",
    "版本": "-",
    "模型": "google/gemma-4-31b-it:free",
    "开始日期": "-",
    "结束日期": "-",
    "状态": "待验证",
    "验真": "待验证",
    "抓取时间": "2026-10-11"
  },
  {
    "id": "intel-common-inceptionlabs",
    "标题": "InceptionLabs 新号 1 亿 free tokens，免信用卡",
    "一句话": "新号 1 亿 free tokens，免信用卡（OpenAI 兼容，推荐模型：mercury-2.5, mercury-2）",
    "怎么领": [
      "申请直达：Dashboard 申请（https://platform.inceptionlabs.ai/dashboard/api-keys）",
      "Base URL：https://api.inceptionlabs.ai/v1",
      "推荐免费模型：mercury-2.5, mercury-2"
    ],
    "链接": "https://platform.inceptionlabs.ai/dashboard/api-keys",
    "品类": "API额度",
    "地域": "海外",
    "版本": "-",
    "模型": "mercury-2.5",
    "开始日期": "-",
    "结束日期": "-",
    "状态": "待验证",
    "验真": "待验证",
    "抓取时间": "2026-10-11"
  },
  {
    "id": "intel-6-火山引擎",
    "标题": "火山引擎 (火山方舟 / 豆包) · 豆包系列大语言模型（Doubao-Seed 等） —— 分别提供 50 万 t…",
    "一句话": "豆包系列大语言模型（Doubao-Seed 等） —— 分别提供 50 万 tokens 免费推理额度； Managed Agents（Agent 编排） —— 赠送 30 小时运行时长 + 500 次 web_search 工具调用，有效期 2 年",
    "怎么领": [
      "前置条件：注册火山引擎账号并完成实名认证",
      "额度有效期：Agent 免费额度有效期 2 年；文本模型以开通页展示为准",
      "官方入口：火山方舟产品页（https://www.volcengine.com/product/ark）"
    ],
    "链接": "https://www.volcengine.com/product/doubao",
    "品类": "API额度",
    "地域": "国内",
    "版本": "-",
    "模型": "-",
    "开始日期": "-",
    "结束日期": "-",
    "状态": "待验证",
    "验真": "待验证",
    "抓取时间": "2026-10-11"
  },
  {
    "id": "intel-8-腾讯云混元",
    "标题": "腾讯云混元 (TokenHub) · Hunyuan-a13b（共享版）—— 首次开通赠送 100 万 tokens…",
    "一句话": "Hunyuan-a13b（共享版）—— 首次开通赠送 100 万 tokens，有效期 1 年； 文本嵌入模型 —— 赠送 100 万 tokens，有效期 1 年； 付费旗舰：混元 Hy4 预览版（2026-08-28 发布）、Hy-MT2-Pro（翻译）、Hy-Role-Latest（角色扮演）、Hy-Image…",
    "怎么领": [
      "前置条件：腾讯云注册并完成实名认证",
      "额度有效期：免费资源包有效期 1 年（官方文档原文）",
      "官方入口：免费额度官方文档（https://cloud.tencent.com/document/product/1729/97731）"
    ],
    "链接": "https://hunyuan.tencent.com/",
    "品类": "API额度",
    "地域": "国内",
    "版本": "-",
    "模型": "Hunyuan-a13b",
    "开始日期": "-",
    "结束日期": "-",
    "状态": "待验证",
    "验真": "待验证",
    "抓取时间": "2026-10-11"
  },
  {
    "id": "intel-10-商汤日日新",
    "标题": "商汤 日日新 (SenseNova) · SenseNova 6.8 Flash Lite（轻量文本）、SenseNov…",
    "一句话": "SenseNova 6.8 Flash Lite（轻量文本）、SenseNova U1 Fast（多模态）等 —— Token Plan 公测免费：每 5 小时 60,000 积分（滚动刷新），单账号可创建 20 个 API Key；各模型按积分计量",
    "怎么领": [
      "前置条件：注册商汤大装置（SenseCore）开放平台账号",
      "额度有效期：公测期间滚动有效（每 5 小时自动刷新）",
      "官方入口：Token Plan 官方页（https://www.sensenova.cn/token-plan）"
    ],
    "链接": "https://www.sensenova.cn/",
    "品类": "API额度",
    "地域": "国内",
    "版本": "-",
    "模型": "SenseNova 6.8 Flash Lite",
    "开始日期": "-",
    "结束日期": "-",
    "状态": "待验证",
    "验真": "待验证",
    "抓取时间": "2026-10-11"
  },
  {
    "id": "intel-11-科大讯飞星火",
    "标题": "科大讯飞星火 (Spark API) · 星火 Lite —— 官方 HTTP 调用文档原文“具有更高的响应速度，支持免…",
    "一句话": "星火 Lite —— 官方 HTTP 调用文档原文“具有更高的响应速度，支持免费使用”，免费额度在星火产品页领取（QPS/限速以领取页规则为准）； 付费版本：Pro、Pro-128K、Max、Max-32K、4.0 Ultra（已升级至 X1.5 快思考模式），另有深度推理 X2 产品线；Max 套餐将于 2026-…",
    "怎么领": [
      "前置条件：讯飞开放平台注册并实名认证",
      "额度有效期：Lite 免费额度以产品页领取规则为准（官方文档无“永久”字样）",
      "官方入口：星火 API 产品页（免费额度领取）（https://xinghuo.xfyun.cn/sparkapi）"
    ],
    "链接": "https://xinghuo.xfyun.cn/",
    "品类": "API额度",
    "地域": "国内",
    "版本": "-",
    "模型": "-",
    "开始日期": "-",
    "结束日期": "-",
    "状态": "待验证",
    "验真": "待验证",
    "抓取时间": "2026-10-11"
  },
  {
    "id": "intel-12-美团longcat",
    "标题": "美团 LongCat · LongCat-2.0（2026-06-30 发布，1M 上下文）—— 调用消…",
    "一句话": "LongCat-2.0（2026-06-30 发布，1M 上下文）—— 调用消耗 token 资源包（新用户包数额以账户到账为准，资源包有效期 30 天）； 旧 LongCat-Flash 系列已于 2026-05-29 下线",
    "怎么领": [
      "前置条件：注册并登录开放平台（定价与资源包页需登录查看）",
      "额度有效期：官方定价页标注 token 资源包有效期 30 天",
      "官方入口：开放平台（https://longcat.chat/platform/）"
    ],
    "链接": "https://longcat.chat/platform/",
    "品类": "API额度",
    "地域": "国内",
    "版本": "-",
    "模型": "LongCat-2.0",
    "开始日期": "-",
    "结束日期": "-",
    "状态": "待验证",
    "验真": "待验证",
    "抓取时间": "2026-10-11"
  },
  {
    "id": "intel-14-streamlake",
    "标题": "StreamLake (快手万擎) · 基础模型推理 —— 注册开通后分批获得免费调用次数（不可抵扣 Batch 批量…",
    "一句话": "基础模型推理 —— 注册开通后分批获得免费调用次数（不可抵扣 Batch 批量推理；具体次数以活动说明为准）； 在架模型：自研 KAT-Coder-Pro-V2.5/KAT-Coder-Air-V2.5（均为 256K 上下文/80K 输出）及托管 DeepSeek-V4-Flash/Pro、GLM-5.x、Mini…",
    "怎么领": [
      "前置条件：注册 StreamLake 账号并开通服务",
      "额度有效期：各资源包有效期以活动说明为准（官方文档无“永久免费”表述）",
      "官方入口：官方主页（https://www.streamlake.com/）"
    ],
    "链接": "https://www.streamlake.com/",
    "品类": "API额度",
    "地域": "国内",
    "版本": "-",
    "模型": "KAT-Coder-Pro-V2.5",
    "开始日期": "-",
    "结束日期": "-",
    "状态": "待验证",
    "验真": "待验证",
    "抓取时间": "2026-10-11"
  },
  {
    "id": "intel-15-云知声tokenhub",
    "标题": "云知声 Token Hub · Unisound U2（通用）、U2-Med（医疗）、U1-OCR、U1-OC…",